{
  "schemaVersion": 1,
  "id": "dracima-dragon-cards",
  "name": "Dracima-Drachenkarten",
  "moduleId": "dragon-cards-card-deck",
  "version": "1.0.2",
  "author": "Daniel Brune",
  "assetBase": "module-root",
  "aiGenerated": true,
  "rights": {
    "code": "LICENSE-CODE.md",
    "artwork": "LICENSE-ARTWORK.md",
    "commercialUse": false,
    "attribution": "Daniel Brune"
  },
  "suits": [
    {
      "id": "hearts",
      "name": "Bierkrug",
      "standardName": "Herz"
    },
    {
      "id": "clubs",
      "name": "Schwert",
      "standardName": "Kreuz"
    },
    {
      "id": "spades",
      "name": "Schild",
      "standardName": "Pik"
    },
    {
      "id": "diamonds",
      "name": "Münze",
      "standardName": "Karo"
    }
  ],
  "cards": [
    {
      "id": "hearts-02",
      "standardSuit": "hearts",
      "standardRank": "2",
      "suitName": "Bierkrug",
      "standardSuitName": "Herz",
      "standardRankName": "2",
      "dragonRankName": null,
      "displayName": "Bierkrug · 2",
      "jokerKind": null,
      "jokerVariant": null,
      "rankSort": 2
    },
    {
      "id": "hearts-03",
      "standardSuit": "hearts",
      "standardRank": "3",
      "suitName": "Bierkrug",
      "standardSuitName": "Herz",
      "standardRankName": "3",
      "dragonRankName": null,
      "displayName": "Bierkrug · 3",
      "jokerKind": null,
      "jokerVariant": null,
      "rankSort": 3
    },
    {
      "id": "hearts-04",
      "standardSuit": "hearts",
      "standardRank": "4",
      "suitName": "Bierkrug",
      "standardSuitName": "Herz",
      "standardRankName": "4",
      "dragonRankName": null,
      "displayName": "Bierkrug · 4",
      "jokerKind": null,
      "jokerVariant": null,
      "rankSort": 4
    },
    {
      "id": "hearts-05",
      "standardSuit": "hearts",
      "standardRank": "5",
      "suitName": "Bierkrug",
      "standardSuitName": "Herz",
      "standardRankName": "5",
      "dragonRankName": null,
      "displayName": "Bierkrug · 5",
      "jokerKind": null,
      "jokerVariant": null,
      "rankSort": 5
    },
    {
      "id": "hearts-06",
      "standardSuit": "hearts",
      "standardRank": "6",
      "suitName": "Bierkrug",
      "standardSuitName": "Herz",
      "standardRankName": "6",
      "dragonRankName": null,
      "displayName": "Bierkrug · 6",
      "jokerKind": null,
      "jokerVariant": null,
      "rankSort": 6
    },
    {
      "id": "hearts-07",
      "standardSuit": "hearts",
      "standardRank": "7",
      "suitName": "Bierkrug",
      "standardSuitName": "Herz",
      "standardRankName": "7",
      "dragonRankName": null,
      "displayName": "Bierkrug · 7",
      "jokerKind": null,
      "jokerVariant": null,
      "rankSort": 7
    },
    {
      "id": "hearts-08",
      "standardSuit": "hearts",
      "standardRank": "8",
      "suitName": "Bierkrug",
      "standardSuitName": "Herz",
      "standardRankName": "8",
      "dragonRankName": null,
      "displayName": "Bierkrug · 8",
      "jokerKind": null,
      "jokerVariant": null,
      "rankSort": 8
    },
    {
      "id": "hearts-09",
      "standardSuit": "hearts",
      "standardRank": "9",
      "suitName": "Bierkrug",
      "standardSuitName": "Herz",
      "standardRankName": "9",
      "dragonRankName": null,
      "displayName": "Bierkrug · 9",
      "jokerKind": null,
      "jokerVariant": null,
      "rankSort": 9
    },
    {
      "id": "hearts-10",
      "standardSuit": "hearts",
      "standardRank": "10",
      "suitName": "Bierkrug",
      "standardSuitName": "Herz",
      "standardRankName": "10",
      "dragonRankName": null,
      "displayName": "Bierkrug · 10",
      "jokerKind": null,
      "jokerVariant": null,
      "rankSort": 10
    },
    {
      "id": "hearts-jack",
      "standardSuit": "hearts",
      "standardRank": "jack",
      "suitName": "Bierkrug",
      "standardSuitName": "Herz",
      "standardRankName": "Bube",
      "dragonRankName": "Drachennestling",
      "displayName": "Bierkrug · Drachennestling",
      "jokerKind": null,
      "jokerVariant": null,
      "rankSort": 11
    },
    {
      "id": "hearts-queen",
      "standardSuit": "hearts",
      "standardRank": "queen",
      "suitName": "Bierkrug",
      "standardSuitName": "Herz",
      "standardRankName": "Dame",
      "dragonRankName": "Jungdrache",
      "displayName": "Bierkrug · Jungdrache",
      "jokerKind": null,
      "jokerVariant": null,
      "rankSort": 12
    },
    {
      "id": "hearts-king",
      "standardSuit": "hearts",
      "standardRank": "king",
      "suitName": "Bierkrug",
      "standardSuitName": "Herz",
      "standardRankName": "König",
      "dragonRankName": "Ausgewachsener Drache",
      "displayName": "Bierkrug · Ausgewachsener Drache",
      "jokerKind": null,
      "jokerVariant": null,
      "rankSort": 13
    },
    {
      "id": "hearts-ace",
      "standardSuit": "hearts",
      "standardRank": "ace",
      "suitName": "Bierkrug",
      "standardSuitName": "Herz",
      "standardRankName": "Ass",
      "dragonRankName": "Uraltdrache",
      "displayName": "Bierkrug · Uraltdrache",
      "jokerKind": null,
      "jokerVariant": null,
      "rankSort": 14
    },
    {
      "id": "hearts-joker",
      "standardSuit": "hearts",
      "standardRank": "joker",
      "suitName": "Bierkrug",
      "standardSuitName": "Herz",
      "standardRankName": "Joker",
      "dragonRankName": "Urdrache",
      "displayName": "Bierkrug · Urdrache (Joker)",
      "jokerKind": "suited",
      "jokerVariant": null,
      "rankSort": 15
    },
    {
      "id": "clubs-02",
      "standardSuit": "clubs",
      "standardRank": "2",
      "suitName": "Schwert",
      "standardSuitName": "Kreuz",
      "standardRankName": "2",
      "dragonRankName": null,
      "displayName": "Schwert · 2",
      "jokerKind": null,
      "jokerVariant": null,
      "rankSort": 2
    },
    {
      "id": "clubs-03",
      "standardSuit": "clubs",
      "standardRank": "3",
      "suitName": "Schwert",
      "standardSuitName": "Kreuz",
      "standardRankName": "3",
      "dragonRankName": null,
      "displayName": "Schwert · 3",
      "jokerKind": null,
      "jokerVariant": null,
      "rankSort": 3
    },
    {
      "id": "clubs-04",
      "standardSuit": "clubs",
      "standardRank": "4",
      "suitName": "Schwert",
      "standardSuitName": "Kreuz",
      "standardRankName": "4",
      "dragonRankName": null,
      "displayName": "Schwert · 4",
      "jokerKind": null,
      "jokerVariant": null,
      "rankSort": 4
    },
    {
      "id": "clubs-05",
      "standardSuit": "clubs",
      "standardRank": "5",
      "suitName": "Schwert",
      "standardSuitName": "Kreuz",
      "standardRankName": "5",
      "dragonRankName": null,
      "displayName": "Schwert · 5",
      "jokerKind": null,
      "jokerVariant": null,
      "rankSort": 5
    },
    {
      "id": "clubs-06",
      "standardSuit": "clubs",
      "standardRank": "6",
      "suitName": "Schwert",
      "standardSuitName": "Kreuz",
      "standardRankName": "6",
      "dragonRankName": null,
      "displayName": "Schwert · 6",
      "jokerKind": null,
      "jokerVariant": null,
      "rankSort": 6
    },
    {
      "id": "clubs-07",
      "standardSuit": "clubs",
      "standardRank": "7",
      "suitName": "Schwert",
      "standardSuitName": "Kreuz",
      "standardRankName": "7",
      "dragonRankName": null,
      "displayName": "Schwert · 7",
      "jokerKind": null,
      "jokerVariant": null,
      "rankSort": 7
    },
    {
      "id": "clubs-08",
      "standardSuit": "clubs",
      "standardRank": "8",
      "suitName": "Schwert",
      "standardSuitName": "Kreuz",
      "standardRankName": "8",
      "dragonRankName": null,
      "displayName": "Schwert · 8",
      "jokerKind": null,
      "jokerVariant": null,
      "rankSort": 8
    },
    {
      "id": "clubs-09",
      "standardSuit": "clubs",
      "standardRank": "9",
      "suitName": "Schwert",
      "standardSuitName": "Kreuz",
      "standardRankName": "9",
      "dragonRankName": null,
      "displayName": "Schwert · 9",
      "jokerKind": null,
      "jokerVariant": null,
      "rankSort": 9
    },
    {
      "id": "clubs-10",
      "standardSuit": "clubs",
      "standardRank": "10",
      "suitName": "Schwert",
      "standardSuitName": "Kreuz",
      "standardRankName": "10",
      "dragonRankName": null,
      "displayName": "Schwert · 10",
      "jokerKind": null,
      "jokerVariant": null,
      "rankSort": 10
    },
    {
      "id": "clubs-jack",
      "standardSuit": "clubs",
      "standardRank": "jack",
      "suitName": "Schwert",
      "standardSuitName": "Kreuz",
      "standardRankName": "Bube",
      "dragonRankName": "Drachennestling",
      "displayName": "Schwert · Drachennestling",
      "jokerKind": null,
      "jokerVariant": null,
      "rankSort": 11
    },
    {
      "id": "clubs-queen",
      "standardSuit": "clubs",
      "standardRank": "queen",
      "suitName": "Schwert",
      "standardSuitName": "Kreuz",
      "standardRankName": "Dame",
      "dragonRankName": "Jungdrache",
      "displayName": "Schwert · Jungdrache",
      "jokerKind": null,
      "jokerVariant": null,
      "rankSort": 12
    },
    {
      "id": "clubs-king",
      "standardSuit": "clubs",
      "standardRank": "king",
      "suitName": "Schwert",
      "standardSuitName": "Kreuz",
      "standardRankName": "König",
      "dragonRankName": "Ausgewachsener Drache",
      "displayName": "Schwert · Ausgewachsener Drache",
      "jokerKind": null,
      "jokerVariant": null,
      "rankSort": 13
    },
    {
      "id": "clubs-ace",
      "standardSuit": "clubs",
      "standardRank": "ace",
      "suitName": "Schwert",
      "standardSuitName": "Kreuz",
      "standardRankName": "Ass",
      "dragonRankName": "Uraltdrache",
      "displayName": "Schwert · Uraltdrache",
      "jokerKind": null,
      "jokerVariant": null,